{
  "attribution": "Data courtesy of nflverse (CC BY 4.0). Unofficial fan-made project; not affiliated with the NFL.",
  "duration": [
    {
      "p": 0.4664,
      "weeks": 1
    },
    {
      "p": 0.214,
      "weeks": 2
    },
    {
      "p": 0.1037,
      "weeks": 3
    },
    {
      "p": 0.0555,
      "weeks": 4
    },
    {
      "p": 0.0357,
      "weeks": 5
    },
    {
      "p": 0.0222,
      "weeks": 6
    },
    {
      "p": 0.017,
      "weeks": 7
    },
    {
      "p": 0.0156,
      "weeks": 8
    },
    {
      "p": 0.0123,
      "weeks": 9
    },
    {
      "p": 0.0099,
      "weeks": 10
    },
    {
      "p": 0.0102,
      "weeks": 11
    },
    {
      "p": 0.0062,
      "weeks": 12
    },
    {
      "p": 0.0081,
      "weeks": 13
    },
    {
      "p": 0.0065,
      "weeks": 14
    },
    {
      "p": 0.0046,
      "weeks": 15
    },
    {
      "p": 0.0043,
      "weeks": 16
    },
    {
      "p": 0.0033,
      "weeks": 17
    },
    {
      "p": 0.0022,
      "weeks": 18
    },
    {
      "p": 0.0014,
      "weeks": 19
    },
    {
      "p": 0.0006,
      "weeks": 20
    },
    {
      "p": 0.0002,
      "weeks": 21
    }
  ],
  "fitSeasons": [
    2012,
    2025
  ],
  "kinds": [
    {
      "kind": "Knee",
      "p": 0.1767
    },
    {
      "kind": "Ankle",
      "p": 0.1428
    },
    {
      "kind": "Hamstring",
      "p": 0.1247
    },
    {
      "kind": "Concussion",
      "p": 0.1221
    },
    {
      "kind": "Shoulder",
      "p": 0.0525
    },
    {
      "kind": "Foot",
      "p": 0.0451
    },
    {
      "kind": "Groin",
      "p": 0.0384
    },
    {
      "kind": "Calf",
      "p": 0.0366
    },
    {
      "kind": "Back",
      "p": 0.0262
    },
    {
      "kind": "Neck",
      "p": 0.0229
    },
    {
      "kind": "Hip",
      "p": 0.0193
    },
    {
      "kind": "Quadricep",
      "p": 0.0182
    },
    {
      "kind": "Illness",
      "p": 0.0167
    },
    {
      "kind": "Toe",
      "p": 0.0137
    },
    {
      "kind": "Hand",
      "p": 0.0122
    }
  ],
  "permanentLoss": {
    "lossRange": [
      1.0,
      3.0
    ],
    "minWeeks": 8,
    "p": 0.0855
  },
  "ratePerPlayerGame": {
    "CB": 0.0279,
    "DL": 0.0171,
    "K": 0.007,
    "LB": 0.0246,
    "OL": 0.0215,
    "P": 0.0029,
    "QB": 0.0112,
    "RB": 0.0253,
    "S": 0.025,
    "TE": 0.0271,
    "WR": 0.0249
  }
}
